{
  "artifact_type": "glm-boundary-placeholder",
  "artifact_version": "0.1.0",
  "artifact_id": "glm-boundary-placeholder",
  "issuer": "external:emanuel-glm",
  "purpose": "Placeholder for Emanuel's GLM artifact or mapping target.",
  "claims": [
    {
      "claim_id": "glm-placeholder-001",
      "claim": "This placeholder represents an adjacent governance-layer manifest for boundary comparison only.",
      "authority_class": "placeholder"
    }
  ],
  "non_claims": [
    "This placeholder does not represent Emanuel's final GLM specification.",
    "This placeholder does not claim StegVerse authority.",
    "This placeholder does not create interoperability.",
    "This placeholder does not create authority inheritance."
  ],
  "authority_scope": {
    "valid_for": [
      "comparison fixture testing",
      "placeholder mapping"
    ],
    "not_valid_for": [
      "formal GLM conformance",
      "GLM authority",
      "StegVerse authority",
      "runtime enforcement"
    ],
    "inherits_authority_from": [],
    "grants_authority_to": []
  }
}
